ticker,date,source,title
indusind,2023-04-29,moneycontrol,"SEBI delivers final order in Karvy demat scam, cracks down on MD and directors"
indusind,2023-04-28,moneycontrol,Buy IndusInd Bank; target of Rs 1450: ICICI Direct
indusind,2023-04-25,moneycontrol,Buy Indusind Bank; target of Rs 1410: YES Securities
indusind,2023-04-25,moneycontrol,Buy IndusInd Bank; target of Rs 1530: Prabhudas Lilladher
indusind,2023-04-25,moneycontrol,Buy IndusInd Bank; target of Rs 1400: Sharekhan
indusind,2023-04-25,moneycontrol,Reduce IndusInd Bank; target of Rs 1025: HDFC Securities
indusind,2023-04-25,moneycontrol,Buy IndusInd Bank; target of Rs 1450: Motilal Oswal
indusind,2023-04-25,moneycontrol,"IPCA Labs’ latest buy, IndusInd Bank’s retail ambitions & consumer goods’ companies Q4 expectations | Market Minutes"
indusind,2023-04-25,moneycontrol,"IndusInd Bank Q4 profit zooms 50% to Rs 2,040 crore: What should be your strategy?"
indusind,2023-04-24,moneycontrol,IndusInd Bank to re-appoint Sumant Kathpalia as MD & CEO effective March 24
indusind,2023-04-24,moneycontrol,"IndusInd Bank Q4 earnings: Net profit zooms 50% to Rs 2,040 crore"
indusind,2023-04-24,moneycontrol,IndusInd Bank shares edge up as brokerages forecast 43.3% rise in Q4 net profit
indusind,2023-04-24,moneycontrol,IndusInd Bank may post 43.3% rise in Q4 net profit today on higher interest income
indusind,2023-04-13,moneycontrol,"IndusInd Bank Q4 Net Profit seen up 50.7% YoY to Rs. 2,110.8 cr: Motilal Oswal"
indusind,2023-04-12,moneycontrol,IndusInd Bank tumbles on possible exclusion from MSCI index
indusind,2023-04-12,moneycontrol,"IndusInd Bank Q4 Net Profit seen up 41.5% YoY to Rs. 1,926.5 cr: Prabhudas Lilladher"
indusind,2023-04-11,moneycontrol,"JICA, Citi to provide $125 million to Indusind Bank for onlending to agri sector"
indusind,2023-04-11,moneycontrol,"IndusInd Bank, Bandhan among major lenders in MUDRA Yojana"
indusind,2023-03-21,moneycontrol,Indian banks' valuations look attractive despite global turmoil: Jefferies
indusind,2023-03-17,moneycontrol,"ZEEL calls report on repayment of $10 million to IndusInd Bank 'speculative', stock falls"
indusind,2023-03-16,moneycontrol,IndusInd Bank shares tumble 3% post large deal
indusind,2023-03-16,moneycontrol,Zee Entertainment agrees to pay IndusInd Bank dues; lender likely to withdraw insolvency case
indusind,2023-03-14,moneycontrol,Buy IndusInd Bank; target of Rs 1400: Sharekhan
indusind,2023-03-14,moneycontrol,"Short Call | Of bank stocks, IndusInd Bank, NSE share deals, rate cuts and Tech M"
indusind,2023-03-14,moneycontrol,India Ratings revokes short-term issuer rating of 25 financial institutions
indusind,2023-03-13,moneycontrol,Buy IndusInd Bank; target of Rs 1450: Motilal Oswal
indusind,2023-03-13,moneycontrol,Brokerages fret over lower tenure extension for IndusInd Bank CEO
indusind,2023-03-10,moneycontrol,RBI approves reappointment of Sumant Kathpalia as MD & CEO of IndusInd Bank
indusind,2023-03-08,moneycontrol,RBI likely to extend IndusInd Bank CEO Sumant Kathpalia’s term by 3 years; stock jumps 4%
indusind,2023-02-20,moneycontrol,"Trade Spotlight | Your strategy for Shree Cement, Ipca Laboratories, IndusInd Bank today"
indusind,2023-02-08,moneycontrol,Five lenders to Adani Group and their exposure to the crisis-ridden conglomerate
indusind,2023-02-03,moneycontrol,IndusInd Bank rises on reports of RBI approval to increasing Hinduja Group's stake
indusind,2023-02-02,moneycontrol,IndusInd Bank promoters Hinduja Group set to increase stake: Sources
kotak,2026-03-18,moneycontrol,"StanChart reviews offers from Kotak, Federal to acquire credit-card-only customers: Report"
kotak,2026-03-09,moneycontrol,"Stocks to Watch Today: RITES, GNFC, IRB Infra, Tata Power, Dr Reddys Labs, Max Estates, Meesho, Kwality Walls, PB Fintech in focus on 9 March"
kotak,2026-02-05,moneycontrol,Hiring spree at Kotak Mahindra Bank means jobs for 500 engineers
kotak,2026-01-28,moneycontrol,Axis Bank overtakes Kotak in market cap after earnings-fuelled rally
kotak,2026-01-27,moneycontrol,Buy Kotak Mahindra Bank; target of Rs 500: Motilal Oswal
kotak,2026-01-27,moneycontrol,Buy Kotak Mahindra Bank; target of Rs 500: Prabhudas Lilladher
kotak,2026-01-27,moneycontrol,"Kotak Mahindra Bank shares tumble 5% after Q3 results miss estimates: Should you buy, sell or hold?"
kotak,2026-01-27,moneycontrol,"Stocks to Watch Today: Axis Bank, Waaree Renewable, PVR Inox, Hindustan Copper, Torrent Pharma, Zydus Life, UltraTech, Urban Company in focus on 27 January"
kotak,2026-01-14,moneycontrol,Did Kotak Mahindra Bank stock really crash 80 percent today? Here’s why investors must not worry
kotak,2026-01-14,moneycontrol,"Stocks to Watch Today: Kotak Mahindra Bank, ICICI Lombard, Tata Elxsi, Interarch Building, NLC India, 5paisa Capital in focus on 14 January"
kotak,2026-01-12,moneycontrol,Kotak Mahindra Bank appoints Anup Kumar Saha as whole-time director
kotak,2026-01-06,moneycontrol,"Stocks to Watch Today: Kotak Mahindra Bank, IndusInd Bank, Trent, Dabur, Waaree Energies, NBCC, KSH International in focus on 6 January"
kotak,2026-01-01,moneycontrol,Buy Kotak Mahindra Bank; target of Rs 2500: Motilal Oswal
kotak,2025-12-19,moneycontrol,RBI slaps Rs 62 lakh fine on Kotak Mahindra Bank
kotak,2025-12-16,moneycontrol,Deutsche Bank’s India retail sale faces valuation hurdles due to wealth biz run down
kotak,2025-12-11,moneycontrol,"Bank shares snap 3-day decline; Kotak Mahindra, HDFC Bank lead gains - here are key levels to watch"
kotak,2025-12-03,moneycontrol,Uday Kotak warns businesses as rupee breaches Rs 90-mark: 'Time to shake out of comfort zone'
kotak,2025-12-02,moneycontrol,"Trade Spotlight: How should you trade Bank of Baroda, PB Fintech, Samvardhana Motherson, Paytm, City Union Bank, and others on December 2?"
kotak,2025-11-24,moneycontrol,"Stocks to Watch Today: TCS, Rail Vikas Nigam, Tata Power, HG Infra, Natco Pharma, Lupin, Shilpa Medicare, IDBI Bank in focus on 24 November"
kotak,2025-11-22,moneycontrol,Kotak Mahindra Bank emerges as frontrunner in IDBI Bank stake sale
kotak,2025-11-21,moneycontrol,Kotak Mahindra Bank board approves 5-for-1 stock split
kotak,2025-11-20,moneycontrol,Income Tax Update: Finance Ministry opens Capital Gains Account Scheme to 19 private banks; check full list
kotak,2025-11-17,moneycontrol,Kotak Mahindra Bank shares rise over 1% ahead of board meet to consider stock split
kotak,2025-11-14,moneycontrol,Kotak Mahindra Bank board to consider stock split next week
kotak,2025-11-11,moneycontrol,Yes Bank emerges as the only top-10 private lender with no ‘buy’ calls
kotak,2025-10-28,moneycontrol,Buy Kotak Mahindra Bank; target of Rs 2650: ICICI Securities
kotak,2025-10-28,moneycontrol,Accumulate Kotak Mahindra Bank; target of Rs 2362: Deven Choksey
kotak,2025-10-27,moneycontrol,Buy Kotak Mahindra Bank; target of Rs 2500: Motilal Oswal
kotak,2025-10-27,moneycontrol,Buy Kotak Mahindra Bank; target of Rs 2480: Prabhudas Lilladher
kotak,2025-10-27,moneycontrol,Kotak Mahindra Bank Q2 FY26: One of the best long-term portfolio stocks?
kotak,2025-10-27,moneycontrol,"Stocks to Watch Today: Coforge, NCC, Kotak Bank, GPT Infra, Vikran Engineering, Eclerx, Container Corporation, RailTel, Thyrocare, IOC in focus on 27 October"
kotak,2025-10-25,moneycontrol,"Kotak Mahindra Bank sees stress in retail commercial vehicles lending segment, says CEO Ashok Vaswani"
kotak,2025-10-25,moneycontrol,"Premature to talk on IDBI Bank, other deals, says Kotak Mahindra Bank CEO Ashok Vaswani"
kotak,2025-10-25,moneycontrol,"Kotak Bank Q2 results: Net profit falls 2.7% YoY, NII up 4% at Rs 7,311 crore"
kotak,2025-10-24,moneycontrol,"Stocks to Watch Today: Kotak Mahindra Bank, Colgate Palmolive, Sagar Cements, Premier Energies, Syrma SGS, Midwest, Hero MotoCorp in focus on 24 October"
kotak,2025-10-13,moneycontrol,"Stocks to Watch Today: Tata Capital, DMart, Waaree Renewable, Phoenix Mills, Mahindra Lifespace, HCC, Travel Food, NTPC Green in focus on 13 October"
kotak,2025-10-06,moneycontrol,"Bank Nifty rises for 5th day to reclaim 56,000-mark on strong Q2 biz updates from HDFC, Kotak Mahindra Bank"
kotak,2025-10-06,moneycontrol,"Stocks to Watch Today: HDFC Bank, Bajaj Finance, IndusInd, Aditya Birla Lifestyle, Lupin, Infosys, Ceigall India, Sobha, Kotak Bank in focus on 06 October"
kotak,2025-10-03,moneycontrol,"Chartist Talk: Close above 25,000 crucial for sustainable rally in Nifty 50, these 2 stocks look overbought now, says Rahul Ghose of Hedged"
kotak,2025-09-29,moneycontrol,Battle for India’s largest mid-sized bank intensifies
kotak,2025-09-26,moneycontrol,"Morgan Stanley picks small stake in 10 companies including BEL, Bharti Airtel, Eternal, Paytm, Hero Moto from Goldman Sachs for Rs 201 crore"
kotak,2025-09-22,moneycontrol,Buy Kotak Mahindra Bank; target of Rs 2400: Motilal Oswal
kotak,2025-09-19,moneycontrol,"Trade Spotlight: How should you trade Kotak Mahindra Bank, Aadhar Housing, Kansai Nerolac, Kfin Tech, Mankind Pharma, Zydus Life, and others on September 19?"
kotak,2025-09-11,moneycontrol,"Stocks to Watch Today: Dr Reddys Labs, Jupiter Wagons, Rail Vikas Nigam, Highway Infrastructure, Mazagon Dock, Tega Industries in focus on 11 September"
kotak,2025-09-11,moneycontrol,"SMBC offloads 1.62% stake in Kotak Mahindra Bank for Rs 6,256 crore"
kotak,2025-09-10,moneycontrol,"Kotak Bank shares gain amid Rs 6,256 crore block deal, Sumitomo Mitsui likely seller"
kotak,2025-09-10,moneycontrol,"Stocks to Watch Today: Kotak Bank, Vikram Solar, Blue Jet Health, Sun Pharma, HEG, Sterling and Wilson, Mamata Machinery, Bikaji Foods in focus on 10 September"
kotak,2025-09-09,moneycontrol,"Sumitomo Mitsui likely to sell entire 1.65% stake in Kotak Mahindra Bank for Rs 6,000 crore via block deals: CNBC-Awaaz"
kotak,2025-08-29,moneycontrol,"UBS upgrades Kotak Bank to a Buy, says non-lending financials will outpace lending businesses"
kotak,2025-08-07,moneycontrol,"Bulk deals: Alibaba-backed Antfin offloads 1.46% stake worth Rs 4,097 crore in Eternal"
kotak,2025-07-29,moneycontrol,Buy Kotak Mahindra Bank; target of Rs 2570: ICICI Securities
kotak,2025-07-29,moneycontrol,Buy Kotak Mahindra Bank; target of Rs 2350: Prabhudas Lilladher
kotak,2025-07-28,moneycontrol,Gainers & Losers: Top 10 stocks that moved the most on July 28
kotak,2025-07-28,moneycontrol,"Kotak Mahindra Bank shares sink 7% on muted Q1 show; should you buy, sell, or hold?"
kotak,2025-07-28,moneycontrol,"Stocks to Watch Today: Kotak Bank, CDSL, Balkrishna Ind, Orient Cement, Tata Chemicals, Poonawalla Fincorp, VA Tech Wabag, RITES in focus on 28 July"
kotak,2025-07-26,moneycontrol,"Kotak Bank aims to keep loans capped at 15%, MFI exposure to remain limited"
kotak,2025-07-26,moneycontrol,"Kotak Bank sees margin low point in Q2 amid repo rate cut impact, recovery likely from H2"
kotak,2025-07-26,moneycontrol,"Kotak Mahindra Bank Q1 Results: Net profit declines 7% to Rs 3,282 crore"
kotak,2025-07-24,moneycontrol,"Kotak Bank Q1 Preview: Healthy loan growth to drive NII, margins likely to compress"
kotak,2025-07-23,moneycontrol,Kotak Bank targets India’s fast-growing affluent customer pool
kotak,2025-07-22,moneycontrol,Axis and Kotak Mahindra Bank report easing employee churn in FY25 even as absolute attrition stays high
kotak,2025-07-16,moneycontrol,"Stocks to Watch Today: Ashok Leyland, Dixon Tech, Zydus Lifesciences, ICICI Lombard, HDB Financial, HDFC Life, Jindal Steel, Biocon in focus on 16 July"
kotak,2025-07-08,moneycontrol,"Kotak Mahindra Bank shares rally over 4% on strong Q1 business update; should you buy, sell or hold?"
kotak,2025-07-08,moneycontrol,"Stocks to Watch Today: Titan, Tata Motors, Navin Fluorine, Refex Industries, JSW Infrastructure, Lodha Developers, Kotak Mahindra Bank in focus on 8 July"
kotak,2025-06-23,moneycontrol,"Trade Spotlight: How should you trade Indus Towers, Kotak Mahindra Bank, NRB Bearings, ICICI Lombard, KFin Technologies, M&M, and others on June 23?"
kotak,2025-06-19,moneycontrol,"Trade Spotlight: How should you trade Asahi India Glass, Avenue Supermarts, AU Small Finance Bank, Cyient, Vedant Fashions, and others on June 19?"
kotak,2025-06-17,moneycontrol,"Trade Spotlight: How should you trade Biocon, Swiggy, Kotak Mahindra Bank, Apollo Hospitals, SJS Enterprises, TCS, Oberoi Realty, and others on June 17?"
kotak,2025-06-02,moneycontrol,Banking Central | What does Kotak Mahindra Bank’s leadership transition signal to investors?
kotak,2025-05-31,moneycontrol,Kotak Mahindra Bank's deputy MD Shanti Ekambaram to step down on October 31
kotak,2025-05-14,moneycontrol,"Bank Nifty plunges 550 pts from day's high; AU SFB, Kotak Mahindra Bank among top losers: What lies ahead?"
kotak,2025-05-07,moneycontrol,"Trade Spotlight: How should you trade Maruti Suzuki, APL Apollo Tubes, Devyani International, Aditya Birla Capital, Motherson, and others on May 8?"
kotak,2025-05-06,moneycontrol,Buy Kotak Mahindra Bank; target of Rs 2500: Sharekhan
kotak,2025-05-05,moneycontrol,"6 of 7 private banks face slump in operating profits, margins in Q4 FY25"
kotak,2025-05-05,moneycontrol,Buy Kotak Mahindra Bank; target of Rs 2500: Motilal Oswal
kotak,2025-05-05,moneycontrol,Reduce Kotak Mahindra Bank; target of Rs 1950: Emkay Global Financial
kotak,2025-05-05,moneycontrol,Buy Kotak Mahindra Bank; target of Rs 2400: Prabhudas Lilladher
kotak,2025-05-05,moneycontrol,Buy Kotak Mahindra Bank; target of Rs 2490: LKP Research
kotak,2025-05-05,moneycontrol,"Kotak Mahindra Bank shares fall 5% after weak Q4 results; should you buy, sell, or hold?"
kotak,2025-05-05,moneycontrol,"Stocks to Watch Today: SBI, Kotak Mahindra Bank, Marico, Indian Bank, RR Kabel, AU SFB, Azad Engineering, IRCON, Concord Biotech in focus on 5 May"
kotak,2025-05-03,moneycontrol,"Credit card segment to reach pre-embargo levels in 6 months, Kotak CEO Vaswani says"
kotak,2025-04-30,moneycontrol,"Kotak Mahindra Bank Q4 Preview: NII, profit set to grow in low single-digit; margin pressure likely"
kotak,2025-04-27,moneycontrol,Check these top 4 stocks turning bullish on charts
kotak,2025-04-08,moneycontrol,"Trade Spotlight: How should you trade Kotak Mahindra Bank, Bajaj Finance, GMR Airports, Chambal Fertilizers, PNB Housing, and others on April 8?"
kotak,2025-03-30,moneycontrol,"Chartist Talks: SBI Securities' Sudeep Shah bullish on these 6 stocks; says good time to accumulate, though market may consolidate"
kotak,2025-03-27,moneycontrol,Kotak Mahindra Bank's private banking unit likely to add thousands of new clients
kotak,2025-03-27,moneycontrol,Buy Kotak Mahindra Bank; target of Rs 2500: Sharekhan
kotak,2025-03-27,moneycontrol,Kotak Mahindra Bank’s Ambuj Chandna joins DBS Bank India
kotak,2025-03-26,moneycontrol,"Kotak Private Bank is open to foreign collaborations provided visions align, says Kotak Private Bank CEO Oisharya Das"
kotak,2025-03-24,moneycontrol,"Kotak Mahindra Bank shares jump 4%, hit over 3-year high on key leadership changes"
kotak,2025-03-24,moneycontrol,Bank Nifty rises for 8th day: Index surges 2%; Kotak Mahindra Bank shares hit three-year high
kotak,2025-03-18,moneycontrol,"Trade Spotlight: How should you trade Coal India, Kotak Mahindra Bank, Varun Beverages, Shriram Finance, JSW Steel, and others on March 18?"
kotak,2025-03-15,moneycontrol,Market likely to be directionless but experts bet on these 8 stocks for next week
kotak,2025-03-14,moneycontrol,Chartist Talks: These two stocks that can brighten your portfolio according to SBI Securities' Sudeep Shah
kotak,2025-03-13,moneycontrol,Should investors bet on IDBI Bank’s disinvestment?
kotak,2025-03-13,moneycontrol,"Trade Spotlight: How should you trade Crompton Greaves Consumer, Tata Motors, Kotak Mahindra Bank, SRF, ITD Cementation, and others on March 13?"
kotak,2025-03-05,moneycontrol,"Trade Spotlight: How should you trade Hindalco, InterGlobe Aviation, Kotak Mahindra Bank, PFC, Crompton Greaves Consumer, and others on March 6?"
kotak,2025-02-24,moneycontrol,"Trade Spotlight: How should you trade Cummins India, NTPC, Kotak Mahindra Bank, Avanti Feeds, Berger Paints, and others on February 25?"
kotak,2025-02-23,moneycontrol,"Stocks to Watch Today: Cipla, Delta Corp, Kotak Bank, JM Financial, Berger Paints, Amara Raja Energy in focus on 21 February"
kotak,2025-02-20,moneycontrol,Kotak Mahindra Bank appoints Vyomesh Kapasi as Head of Products - Consumer Bank
kotak,2025-02-19,moneycontrol,"Trade Spotlight: How should you trade Kotak Mahindra Bank, Zomato, UPL, BSE, Ashok Leyland, and others on February 20?"
kotak,2025-02-18,moneycontrol,Analyst Call Tracker: Street favors Kotak Bank in Jan; can the stock break out of 4-yr range?
kotak,2025-02-17,moneycontrol,"Trade Spotlight: How should you trade Bajaj Finance, ICICI Bank, Tata Consumer Products, Redington, Kaveri Seed, and others on February 17?"
kotak,2025-02-13,moneycontrol,Kotak Mahindra Bank shares hit fresh 52-week high as brokerages cheer RBI's digital nod
kotak,2025-02-13,moneycontrol,"Stocks to Watch Today: Kotak Mahindra Bank, ICICI Bank, RailTel, Vakrangee, Medi Assist, RCF, Honasa Consumer, Muthoot Finance in focus on 13 February"
kotak,2025-02-12,moneycontrol,RBI removes restrictions on Kotak Mahindra Bank onboarding customers online
kotak,2025-02-11,moneycontrol,"Trade Spotlight: How should you trade Tata Steel, Kotak Mahindra Bank, Hero MotoCorp, UPL, Chambal Fertilisers, and other on February 11?"
kotak,2025-02-07,moneycontrol,"RBI repo rate cut: Bajaj Finance, Maruti Suzuki, ICICI Bank... Top 11 stocks to bet on post the cut"
kotak,2025-02-07,moneycontrol,Trade Spotlight: How should you trade these interest rate sensitive stocks on February 7?
kotak,2025-01-30,moneycontrol,Kotak Mahindra Bank's senior retail banking executive resigns; shares decline
kotak,2025-01-24,moneycontrol,"Stocks to Watch Today: Indus Towers, Dr Reddys Labs, United Spirits, Akums Drugs, EMA Partners, Jyoti Structures, Cyient in focus on 24 January"
kotak,2025-01-23,moneycontrol,"Kotak Mahindra Bank acquires personal loan book of Standard Chartered India for Rs 3,330 crore"
kotak,2025-01-22,moneycontrol,Accumulate Kotak Mahindra Bank; target of Rs 2164: KR Choksey
kotak,2025-01-21,moneycontrol,Buy Kotak Mahindra Bank; target of Rs 2100: Motilal Oswal
kotak,2025-01-20,moneycontrol,Buy Kotak Mahindra Bank; target of Rs 2010: Anand Rathi
kotak,2025-01-20,moneycontrol,Buy Kotak Mahindra Bank; target of Rs 2230: Prabhudas Lilladher
kotak,2025-01-20,moneycontrol,Buy Kotak Mahindra Bank; target of Rs 2100: Sharekhan
kotak,2025-01-20,moneycontrol,"Kotak Mahindra Bank Q3: Brokerages upgrade stock on strong performance, reversal of RBI ban awaited; stock jumps 9%"
kotak,2025-01-20,moneycontrol,"Stocks to Watch Today: Wipro, Tech Mahindra, Kotak Bank, RBL Bank, Gland Pharma, Zydus Life, Ashapura Minechem, Laxmi Dental in focus on 20 January"
kotak,2025-01-18,moneycontrol,"Tapering slippages in personal loans, credit cards offset micro-finance stress in Q3: Kotak Mahindra Bank"
kotak,2025-01-18,moneycontrol,"RBI embargo hit credit card, unsecured business in Q3FY25, says Kotak Mahindra Bank"
kotak,2025-01-18,moneycontrol,"High delinquencies in microfinance segment widen Q3 slippages, says Kotak Mahindra Bank"
kotak,2025-01-18,moneycontrol,"Kotak Mahindra Bank Q3 results: Net profit rises 10% YoY to Rs 4,701 crore"
kotak,2025-01-16,moneycontrol,Kotak Bank Q3 Preview: Double-digit profit growth likely; margin pressure risks loom
kotak,2025-01-06,moneycontrol,"Kotak Bank shares slip as CTO, COO Milind Nagnur resigns; Nomura maintains ""buy"" rating"
kotak,2025-01-05,moneycontrol,"Stocks to Watch Today: ITC, HDFC Bank, Bajaj Finance, AU SFB, Nykaa, HG Infra, Brigade Enterprises, NTPC Green, Marico, Bank of Baroda in focus on 6 January"
kotak,2025-01-03,moneycontrol,Major exit at Kotak Mahindra Bank as COO and CTO Milind Nagnur steps down
kotak,2025-01-03,moneycontrol,"Trade Spotlight: How should you trade Kotak Mahindra Bank, Kalyan Jewellers, HCL Technologies, ITC, PB Fintech, and others on January 3?"
kotak,2025-01-02,moneycontrol,"Kotak Mahindra Bank shares gain as Citi Research upgrades to 'buy', sees 16% upside"
kotak,2024-11-27,moneycontrol,Kotak Bank shares gain after CCI approves acquisition of Standard Chartered's personal loan book
kotak,2024-11-27,moneycontrol,Competition Commission approves Kotak Bank's acquisition of StanChart India's personal loans portfolio
kotak,2024-11-27,moneycontrol,"Stock Radar: NTPC Green Energy, Siemens, Zee Entertainment, Kotak Bank, Zaggle, Wipro, Dabur in focus on Wednesday"
kotak,2024-10-22,moneycontrol,Neutral Kotak Mahindra Bank; target of Rs 1950: Motilal Oswal
kotak,2024-10-21,moneycontrol,Accumulate Kotak Mahindra Bank; target of Rs 2025: KR Choksey
kotak,2024-10-21,moneycontrol,Buy Kotak Mahindra Bank; target of Rs 2230 Prabhudas Lilladher
kotak,2024-10-21,moneycontrol,Reduce Kotak Mahindra Bank; target of Rs 1700: Emkay Global Financial
kotak,2024-10-21,moneycontrol,Buy Kotak Mahindra Bank; target of Rs 2100: Sharekhan
kotak,2024-10-21,moneycontrol,"Kotak Mahindra Bank top Nifty loser as Q2 results disappoint Street, RBI embargo may weigh on outlook"
kotak,2024-10-21,moneycontrol,"Stock Radar: HDFC Bank, Tech Mahindra, JSW Steel, UCO Bank, JM Financial, MCX, Tata Consumer in focus on Monday"
kotak,2024-10-19,moneycontrol,Kotak Mahindra Bank eyes tractor demand revival in H2 despite flat growth in H1
kotak,2024-10-19,moneycontrol,"Kotak Mahindra Bank Q2 results: Net profit rises 5% to Rs 3,344 crore, misses market estimates"
kotak,2024-10-18,moneycontrol,"Kotak Bank to acquire the Rs 4,100 crore personal loan book of StanChart Bank"
kotak,2024-10-18,moneycontrol,"Kotak Mahindra Bank Q2 preview: NII may increase 10% to Rs 6,977 crore"
kotak,2024-10-18,moneycontrol,"Stock Radar: Infosys, Wipro, Axis Bank, LTIMindtree, Zomato, MGL, IGL, Polycab, Tata Chemicals in focus on Friday"
kotak,2024-10-17,moneycontrol,Kotak Bank cuts savings rate by 50 bps to 3% on sub-Rs 5 lakh account balance
kotak,2024-10-11,moneycontrol,"UBS hikes target price on Kotak Mahindra Bank, but maintains neutral outlook"
kotak,2024-10-10,moneycontrol,"Trade Spotlight: How should you trade Tata Motors, Gujarat Alkalies, Kotak Bank, CG Power, Mazagon Dock and others on Friday?"
kotak,2024-10-09,moneycontrol,Cred appoints former Kotak Mahindra Bank's group president Arvind Kathpalia as chief risk advisor
kotak,2024-10-01,moneycontrol,"MC Exclusive | RBI ban is like baptism by fire, cannot let a crisis go wasted: Ashok Vaswani, MD & CEO, Kotak Mahindra Bank"
kotak,2024-10-01,moneycontrol,MC Exclusive | Reserve Bank ban ‘lit a fire under us’: Ashok Vaswani
kotak,2024-10-01,moneycontrol,"MC Exclusive | Uday Kotak is my greatest strategic asset, says Ashok Vaswani, MD, Kotak Mahindra Bank"
kotak,2024-10-01,moneycontrol,"MC Exclusive | Will look at every inorganic opportunity: Ashok Vaswani, MD &amp; CEO, Kotak Mahindra Bank"
kotak,2024-09-23,moneycontrol,"Trade Spotlight: How should you trade Siemens, Mankind Pharma, Kotak Bank, DLF, Indegene and others on Tuesday?"
kotak,2024-09-20,moneycontrol,"Trade Spotlight: How should you trade Zomato, Kotak Bank, Dabur, AU SFB, Aditya Birla Capital and others on Friday?"
kotak,2024-09-17,moneycontrol,"Trade Spotlight: How should you trade Hero MotoCorp, PB Fintech, Birlasoft, HDFC Bank, CG Power and others on Wednesday?"
kotak,2024-09-09,moneycontrol,"MC Exclusive: InCred CFO Vivek Bansal quits to launch fintech startup, Kotak President Sunil Daga set to join"
kotak,2024-08-13,moneycontrol,"Stock Radar: Vodafone Idea, Orchid Pharma, JSW Steel, FirstCry, Hindustan Copper, Power Grid in focus on Tuesday"
kotak,2024-08-01,moneycontrol,RBI issues ‘fit & proper’ certificates to potential IDBI Bank suitors: Report
kotak,2024-07-26,moneycontrol,Accumulate Kotak Mahindra Bank; target of Rs 1935: KR Choksey
kotak,2024-07-24,moneycontrol,"Kotak veteran Diwanji to step down, consumer banking division to be revamped"
kotak,2024-07-24,moneycontrol,Reduce Kotak Mahindra Bank: target of Rs 1700: Emkay
kotak,2024-07-23,moneycontrol,"Hold Kotak Mahindra Bank; target of Rs 1,730: ICICI Securities"
kotak,2024-07-23,moneycontrol,Buy Kotak Mahindra Bank; target of Rs 2125: Prabhudas Lilladher
kotak,2024-07-22,moneycontrol,Kotak Mahindra Bank appoints Grant Thornton as external auditor post RBI action
kotak,2024-07-22,moneycontrol,Gainers & losers: Stocks and sectors that moved the most on July 22
kotak,2024-07-22,moneycontrol,"Buy Kotak Mahindra Bank; target of Rs 2,000: Sharekhan"
kotak,2024-07-22,moneycontrol,Kotak Mahindra Bank's Q1 results evoke mixed brokerage views; stock down 3%
kotak,2024-07-22,moneycontrol,"Stock Radar: RIL, HDFC Bank, Wipro, Yes Bank, IRCTC, EMS, Kotak Bank in focus on Monday"
kotak,2024-07-20,moneycontrol,"Digital curbs impact Kotak Bank's unsecured loan book growth, margin in Q1FY25"
kotak,2024-07-20,moneycontrol,"Kotak Bank's cost to income ratio, excluding Kotak GI stake sale, stands at 46.3%: CFO"
kotak,2024-07-19,moneycontrol,"Kotak Bank Q1 preview: Loan growth to drive profit, NII; margin pressure likely"
kotak,2024-07-16,moneycontrol,"Axis Bank, Kotak Mahindra Bank see lower attrition in FY24"
kotak,2024-07-10,moneycontrol,"Kotak Mahindra Bank Q1 Net Profit may dip 2.1% YoY to Rs. 3,379.5 cr: Prabhudas Lilladher"
kotak,2024-07-03,moneycontrol,Kotak Mahindra Bank issues clarification on public statements made by Hindenburg
kotak,2024-07-02,moneycontrol,Kotak Group Fund says it wasn't aware that Hindenburg was partner of its investors
kotak,2024-07-02,moneycontrol,"Kotak bank created and oversaw offshore fund that partner used to short Adani stocks, says Hindenburg"
kotak,2024-06-24,moneycontrol,"Kotak Mahindra Bank to add up to 200 branches in FY25, official says"
kotak,2024-06-17,moneycontrol,"Interview| Kotak Mahindra Bank to go aggressive on new outposts, targets 200 branches in FY25, says senior official"
